[
  {
    "id": "25",
    "is_cycling_related": false,
    "directness": "unrelated",
    "subcategory": "unrelated",
    "confidence": 0.85,
    "needs_human_review": false,
    "reason_de": "Es handelt sich um eine allgemeine Straßenschadensmeldung ohne expliziten Bezug zur Radinfrastruktur."
  },
  {
    "id": "35",
    "is_cycling_related": true,
    "directness": "indirect",
    "subcategory": "pothole_damage",
    "confidence": 0.75,
    "needs_human_review": true,
    "reason_de": "Überflutete Straßenbereiche und verstopfte Gullys beeinträchtigen Radfahrer erheblich."
  },
  {
    "id": "36",
    "is_cycling_related": true,
    "directness": "indirect",
    "subcategory": "pothole_damage",
    "confidence": 0.75,
    "needs_human_review": true,
    "reason_de": "Verstopfte Gullys an Kreuzungen stellen ein Sicherheitsrisiko für den Radverkehr dar."
  },
  {
    "id": "37",
    "is_cycling_related": false,
    "directness": "unrelated",
    "subcategory": "unrelated",
    "confidence": 0.95,
    "needs_human_review": false,
    "reason_de": "Eine defekte Sitzbank ist nicht für den Radverkehr relevant."
  },
  {
    "id": "40",
    "is_cycling_related": false,
    "directness": "unrelated",
    "subcategory": "unrelated",
    "confidence": 0.9,
    "needs_human_review": false,
    "reason_de": "Abgemeldete Fahrzeuge ohne Behinderung des Radverkehrs sind nicht relevant."
  },
  {
    "id": "51",
    "is_cycling_related": true,
    "directness": "direct",
    "subcategory": "pothole_damage",
    "confidence": 1.0,
    "needs_human_review": false,
    "reason_de": "Lose Steine auf der Straße stellen eine direkte Gefahr für Radfahrende dar."
  },
  {
    "id": "52",
    "is_cycling_related": false,
    "directness": "unrelated",
    "subcategory": "unrelated",
    "confidence": 0.95,
    "needs_human_review": false,
    "reason_de": "Vermüllung innerhalb eines privaten Ladens ist nicht relevant für die öffentliche Radinfrastruktur."
  },
  {
    "id": "64",
    "is_cycling_related": false,
    "directness": "unrelated",
    "subcategory": "unrelated",
    "confidence": 0.8,
    "needs_human_review": true,
    "reason_de": "Der Bericht bezieht sich explizit auf Gehwege, nicht auf Radwege."
  },
  {
    "id": "67",
    "is_cycling_related": false,
    "directness": "unrelated",
    "subcategory": "unrelated",
    "confidence": 0.9,
    "needs_human_review": false,
    "reason_de": "Ein Wohnwagen, der eine private Ausfahrt blockiert, ist nicht radverkehrsrelevant."
  },
  {
    "id": "70",
    "is_cycling_related": true,
    "directness": "direct",
    "subcategory": "other_cycling",
    "confidence": 0.9,
    "needs_human_review": false,
    "reason_de": "Ein im Graben liegendes Lastenrad betrifft die cycling-Sicherheit oder die Infrastruktur."
  },
  {
    "id": "72",
    "is_cycling_related": false,
    "directness": "unrelated",
    "subcategory": "unrelated",
    "confidence": 0.85,
    "needs_human_review": false,
    "reason_de": "Vermüllung durch Zeitungen ist ein allgemeines Problem der Stadtsauberkeit ohne direkten Radbezug."
  },
  {
    "id": "73",
    "is_cycling_related": false,
    "directness": "unrelated",
    "subcategory": "unrelated",
    "confidence": 0.9,
    "needs_human_review": false,
    "reason_de": "Ein parkendes Auto ohne Behinderung ist nicht radverkehrsrelevant."
  },
  {
    "id": "75",
    "is_cycling_related": false,
    "directness": "unrelated",
    "subcategory": "unrelated",
    "confidence": 0.9,
    "needs_human_review": false,
    "reason_de": "Ein parkendes Auto ohne Behinderung ist nicht radverkehrsrelevant."
  },
  {
    "id": "79",
    "is_cycling_related": true,
    "directness": "direct",
    "subcategory": "pothole_damage",
    "confidence": 1.0,
    "needs_human_review": false,
    "reason_de": "Schlaglöcher im Fahrbereich von Radfahrern stellen eine direkte Gefahr dar."
  },
  {
    "id": "81",
    "is_cycling_related": true,
    "directness": "direct",
    "subcategory": "pothole_damage",
    "confidence": 1.0,
    "needs_human_review": false,
    "reason_de": "Ein gefährlicher Absatz in der Fahrbahn stellt ein hohes Sturzrisiko für Radfahrende dar."
  },
  {
    "id": "84",
    "is_cycling_related": true,
    "directness": "direct",
    "subcategory": "pothole_damage",
    "confidence": 0.95,
    "needs_human_review": false,
    "reason_de": "Lose Pflastersteine auf der Fahrbahn stellen eine unmittelbare Gefahr für Radfahrende dar."
  },
  {
    "id": "86",
    "is_cycling_related": true,
    "directness": "direct",
    "subcategory": "vegetation_block",
    "confidence": 1.0,
    "needs_human_review": false,
    "reason_de": "Sträucher ragen direkt in einen gemeinsamen Geh- und Radweg hinein."
  },
  {
    "id": "91",
    "is_cycling_related": true,
    "directness": "indirect",
    "subcategory": "vegetation_block",
    "confidence": 0.8,
    "needs_human_review": true,
    "reason_de": "Ein blockierter Weg in einem Park ist oft Teil der Radinfrastruktur, erfordert aber eine Standortprüfung."
  },
  {
    "id": "92",
    "is_cycling_related": false,
    "directness": "unrelated",
    "subcategory": "unrelated",
    "confidence": 0.9,
    "needs_human_review": false,
    "reason_de": "Dies ist ein allgemeiner Verbesserungsvorschlag zur Instandhaltungsqualität ohne konkreten Schadensbezug."
  },
  {
    "id": "94",
    "is_cycling_related": true,
    "directness": "indirect",
    "subcategory": "pothole_damage",
    "confidence": 0.95,
    "needs_human_review": false,
    "reason_de": "Wasseransammlungen an einer Kreuzung behindern Radfahrende massiv und zwingen sie zum Ausweichen."
  },
  {
    "id": "105",
    "is_cycling_related": true,
    "directness": "direct",
    "subcategory": "vegetation_block",
    "confidence": 0.9,
    "needs_human_review": false,
    "reason_de": "Durch Bewuchs verursachte Engstellen auf Gehwegen betreffen Radfahrende, falls der Gehweg zur Radnutzung freigegeben ist."
  },
  {
    "id": "106",
    "is_cycling_related": true,
    "directness": "direct",
    "subcategory": "other_cycling",
    "confidence": 0.85,
    "needs_human_review": false,
    "reason_de": "Es handelt sich um ein möglicherweise abgestelltes oder herrenloses Fahrrad im öffentlichen Raum."
  },
  {
    "id": "111",
    "is_cycling_related": true,
    "directness": "direct",
    "subcategory": "pothole_damage",
    "confidence": 0.95,
    "needs_human_review": false,
    "reason_de": "Tiefe Löcher im Fahrspurbereich sind eine direkte Gefahr für Radfahrende."
  },
  {
    "id": "117",
    "is_cycling_related": false,
    "directness": "unrelated",
    "subcategory": "unrelated",
    "confidence": 0.9,
    "needs_human_review": false,
    "reason_de": "Ein abgestelltes Fahrzeug ist ohne Hinweis auf eine Blockade von Radwegen nicht direkt radverkehrsrelevant."
  },
  {
    "id": "126",
    "is_cycling_related": true,
    "directness": "direct",
    "subcategory": "pothole_damage",
    "confidence": 0.95,
    "needs_human_review": false,
    "reason_de": "Wiederkehrende Straßenschäden an derselben Stelle beeinträchtigen die Sicherheit von Radfahrenden."
  },
  {
    "id": "133",
    "is_cycling_related": false,
    "directness": "unrelated",
    "subcategory": "unrelated",
    "confidence": 0.9,
    "needs_human_review": false,
    "reason_de": "Abgemeldete PKW auf einem Parkplatz haben keinen direkten Einfluss auf die Radinfrastruktur."
  },
  {
    "id": "140",
    "is_cycling_related": false,
    "directness": "unrelated",
    "subcategory": "unrelated",
    "confidence": 0.8,
    "needs_human_review": true,
    "reason_de": "Ein blockierter Wasserabfluss in einem Wasserzug ist primär ein Entwässerungsproblem und erfordert eine Überprüfung der Lage."
  },
  {
    "id": "141",
    "is_cycling_related": false,
    "directness": "unrelated",
    "subcategory": "unrelated",
    "confidence": 0.9,
    "needs_human_review": false,
    "reason_de": "Müll auf einem Pendlerparkplatz betrifft den Radverkehr nicht direkt."
  },
  {
    "id": "142",
    "is_cycling_related": true,
    "directness": "indirect",
    "subcategory": "pothole_damage",
    "confidence": 0.75,
    "needs_human_review": true,
    "reason_de": "Defekte Poller und Beeteinfassungen können Radwege gefährden, bedürfen aber einer örtlichen Prüfung."
  },
  {
    "id": "144",
    "is_cycling_related": true,
    "directness": "indirect",
    "subcategory": "crossing_safety",
    "confidence": 0.85,
    "needs_human_review": false,
    "reason_de": "Eine mangelhafte Beleuchtung von Hindernissen im Straßenraum gefährdet Radfahrende bei Dunkelheit."
  },
  {
    "id": "145",
    "is_cycling_related": true,
    "directness": "direct",
    "subcategory": "vegetation_block",
    "confidence": 1.0,
    "needs_human_review": false,
    "reason_de": "Ein umgekippter Baum behindert direkt eine explizit benannte Fahrradroute."
  },
  {
    "id": "146",
    "is_cycling_related": false,
    "directness": "unrelated",
    "subcategory": "unrelated",
    "confidence": 0.8,
    "needs_human_review": true,
    "reason_de": "Die Meldung ist zu vage, um einen spezifischen Bezug zum Radverkehr herzustellen."
  },
  {
    "id": "156",
    "is_cycling_related": true,
    "directness": "indirect",
    "subcategory": "pothole_damage",
    "confidence": 0.85,
    "needs_human_review": true,
    "reason_de": "Es wird ein Weg zur Haarenniederung beschrieben, der bei Regen unpassierbar ist, was Radfahrer betreffen kann."
  },
  {
    "id": "164",
    "is_cycling_related": true,
    "directness": "indirect",
    "subcategory": "pothole_damage",
    "confidence": 0.9,
    "needs_human_review": false,
    "reason_de": "Ein Schlagloch an einer Kreuzung stellt eine unmittelbare Gefahr für Radfahrende dar."
  },
  {
    "id": "168",
    "is_cycling_related": false,
    "directness": "unrelated",
    "subcategory": "unrelated",
    "confidence": 0.95,
    "needs_human_review": false,